### ISSUE TITLE
[Bug]: SimpleX macos client blasting TCP RESETS

### ISSUE THREAD

**Issue by SkyperTHC** [simplex-chat/simplex-chat#5162]
### Is there an existing issue for this?

- [X] I have searched the existing issues

### Platform

Mac

### OS version

Sequoia 15.1

### App version

5.8.0

### Current Behavior

SimpleX client sending out TCP RST packets at 2MB/sec rate.

### Expected Behavior

To close the TCP connection and stop blasting TCP RST out.

### Steps To Reproduce

not known

### Relevant log output

```shell
I noticed a spike in my egress network traffic. It came down to SimpleX blasting out TCP RST packets. Here is the tcpdump. Note that there were no other packets on the wire at all, just Simplex blasting TCP RST out:


08:57:07.011187 IP 10.66.218.133.56766 > 172.232.158.240.5223: Flags [R.], seq 0, ack 1, win 2048, length 0
08:57:07.011277 IP 10.66.218.133.56766 > 172.232.158.240.5223: Flags [R.], seq 0, ack 1, win 2048, length 0
08:57:07.011289 IP 10.66.218.133.56766 > 172.232.158.240.5223: Flags [R.], seq 0, ack 1, win 2048, length 0
08:57:07.011299 IP 10.66.218.133.56766 > 172.232.158.240.5223: Flags [R.], seq 0, ack 1, win 2048, length 0
08:57:07.011309 IP 10.66.218.133.56766 > 172.232.158.240.5223: Flags [R.], seq 0, ack 1, win 2048, length 0
08:57:07.011320 IP 10.66.218.133.56766 > 172.232.158.240.5223: Flags [R.], seq 0, ack 1, win 2048, length 0
08:57:07.011346 IP 10.66.218.133.56766 > 172.232.158.240.5223: Flags [R.], seq 0, ack 1, win 2048, length 0
08:57:07.011363 IP 10.66.218.133.56766 > 172.232.158.240.5223: Flags [R.], seq 0, ack 1, win 2048, length 0
```

It was at a staggering 2MB/sec rate and overall the data consumption was 450 GB of TCP RST packets.

I killed the SimpleX client and the flood stopped.
```
